{
  "$schema": "https://json-schema.org/draft/2020-12/schema",
  "$id": "https://local-pii.dev/schemas/cli/batch-scan-report/2.0.0",
  "title": "Bounded batch scan report with completion policy",
  "description": "Privacy-safe aggregate manifest for one bounded recursive rules-only scan attempt, including the explicit completion policy. Paths, names, content digests, values, native locations, and patterns are excluded.",
  "schemaVersion": "2.0.0",
  "type": "object",
  "additionalProperties": false,
  "required": ["schemaVersion", "operation", "outcome", "completionPolicy", "detectorBundleVersion", "manifest", "selection", "limits"],
  "properties": {
    "schemaVersion": { "const": "2.0.0" },
    "operation": { "const": "BATCH_SCAN" },
    "outcome": { "enum": ["SUCCEEDED", "NEEDS_REVIEW", "PARTIAL", "FAILED"] },
    "completionPolicy": { "enum": ["REQUIRE_COMPLETE", "ALLOW_PARTIAL"] },
    "detectorBundleVersion": { "type": "string", "minLength": 1, "maxLength": 100 },
    "manifest": {
      "type": "object",
      "additionalProperties": false,
      "required": ["complete", "selectedFileCount", "processedFileCount", "failedFileCount", "directoryCount", "entryCount", "totalInputBytes", "processedInputBytes", "detectionCount", "conflictCount", "byEntity", "failuresByCode"],
      "properties": {
        "complete": { "type": "boolean" },
        "selectedFileCount": { "type": "integer", "minimum": 0, "maximum": 1000 },
        "processedFileCount": { "type": "integer", "minimum": 0, "maximum": 1000 },
        "failedFileCount": { "type": "integer", "minimum": 0, "maximum": 1000 },
        "directoryCount": { "type": "integer", "minimum": 1, "maximum": 1000 },
        "entryCount": { "type": "integer", "minimum": 0, "maximum": 10000 },
        "totalInputBytes": { "type": "integer", "minimum": 0, "maximum": 268435456 },
        "processedInputBytes": { "type": "integer", "minimum": 0, "maximum": 268435456 },
        "detectionCount": { "type": "integer", "minimum": 0, "maximum": 1000000000 },
        "conflictCount": { "type": "integer", "minimum": 0, "maximum": 1000000000 },
        "byEntity": {
          "type": "object",
          "propertyNames": { "$ref": "https://local-pii.dev/schemas/common/entity-type/1.0.0" },
          "additionalProperties": { "type": "integer", "minimum": 1, "maximum": 1000000000 }
        },
        "failuresByCode": {
          "type": "object",
          "propertyNames": {
            "enum": [
              "CONTRACT_UNSUPPORTED", "SCHEMA_INVALID", "IDEMPOTENCY_CONFLICT",
              "INPUT_TOO_LARGE", "FORMAT_UNSUPPORTED", "FORMAT_ENCRYPTED", "FORMAT_CORRUPT",
              "POLICY_UNSATISFIABLE", "POLICY_REVIEW_REQUIRED", "POLICY_BLOCKED",
              "REQUIRED_DETECTOR_UNAVAILABLE", "MODEL_UNAVAILABLE", "DETECTOR_TIMEOUT",
              "DETECTION_LIMIT_EXCEEDED", "MODEL_OUTPUT_INVALID", "SOURCE_MAP_INVALID",
              "REDACTION_PLAN_CONFLICT", "REDACTION_COUNT_MISMATCH", "VERIFICATION_RESIDUAL",
              "VERIFICATION_INCOMPLETE", "FIDELITY_OUT_OF_RANGE", "ARTIFACT_DIGEST_MISMATCH",
              "STORAGE_UNAVAILABLE", "JOB_CONFLICT", "OUTPUT_COLLISION", "RATE_LIMITED",
              "SUPPLY_CHAIN_INVALID", "AUTHORIZATION_DENIED", "OPERATION_CANCELLED", "INTERNAL_ERROR"
            ]
          },
          "additionalProperties": { "type": "integer", "minimum": 1, "maximum": 1000 }
        }
      }
    },
    "selection": {
      "type": "object",
      "additionalProperties": false,
      "required": ["includePatternCount", "excludePatternCount"],
      "properties": {
        "includePatternCount": { "type": "integer", "minimum": 1, "maximum": 32 },
        "excludePatternCount": { "type": "integer", "minimum": 0, "maximum": 32 }
      }
    },
    "limits": {
      "type": "object",
      "additionalProperties": false,
      "required": ["maximumFiles", "maximumDirectories", "maximumEntries", "maximumTotalInputBytes", "maximumRelativePathCodeUnits", "maximumPatternMatchSteps", "timeoutMs"],
      "properties": {
        "maximumFiles": { "const": 1000 },
        "maximumDirectories": { "const": 1000 },
        "maximumEntries": { "const": 10000 },
        "maximumTotalInputBytes": { "const": 268435456 },
        "maximumRelativePathCodeUnits": { "const": 8192 },
        "maximumPatternMatchSteps": { "const": 100000000 },
        "timeoutMs": { "type": "integer", "minimum": 1000, "maximum": 300000 }
      }
    }
  },
  "allOf": [
    {
      "if": { "properties": { "outcome": { "const": "SUCCEEDED" } } },
      "then": {
        "properties": {
          "manifest": {
            "type": "object",
            "additionalProperties": true,
            "properties": {
              "complete": { "const": true },
              "failedFileCount": { "const": 0 },
              "conflictCount": { "const": 0 },
              "failuresByCode": { "type": "object", "additionalProperties": true, "maxProperties": 0 }
            }
          }
        }
      }
    },
    {
      "if": { "properties": { "outcome": { "const": "NEEDS_REVIEW" } } },
      "then": {
        "properties": {
          "manifest": {
            "type": "object",
            "additionalProperties": true,
            "properties": {
              "complete": { "const": true },
              "failedFileCount": { "const": 0 },
              "conflictCount": { "type": "integer", "minimum": 1 },
              "failuresByCode": { "type": "object", "additionalProperties": true, "maxProperties": 0 }
            }
          }
        }
      }
    },
    {
      "if": { "properties": { "outcome": { "const": "PARTIAL" } } },
      "then": {
        "properties": {
          "manifest": {
            "type": "object",
            "additionalProperties": true,
            "properties": {
              "complete": { "const": false },
              "processedFileCount": { "type": "integer", "minimum": 1 },
              "failedFileCount": { "type": "integer", "minimum": 1 },
              "failuresByCode": { "type": "object", "additionalProperties": true, "minProperties": 1 }
            }
          }
        }
      }
    },
    {
      "if": { "properties": { "outcome": { "const": "FAILED" } } },
      "then": {
        "properties": {
          "manifest": {
            "type": "object",
            "additionalProperties": true,
            "properties": {
              "complete": { "const": false },
              "processedFileCount": { "const": 0 },
              "failedFileCount": { "type": "integer", "minimum": 1 },
              "failuresByCode": { "type": "object", "additionalProperties": true, "minProperties": 1 }
            }
          }
        }
      }
    }
  ],
  "examples": [
    {
      "schemaVersion": "2.0.0",
      "operation": "BATCH_SCAN",
      "outcome": "PARTIAL",
      "completionPolicy": "ALLOW_PARTIAL",
      "detectorBundleVersion": "0.2.0",
      "manifest": {
        "complete": false,
        "selectedFileCount": 2,
        "processedFileCount": 1,
        "failedFileCount": 1,
        "directoryCount": 2,
        "entryCount": 3,
        "totalInputBytes": 128,
        "processedInputBytes": 64,
        "detectionCount": 1,
        "conflictCount": 0,
        "byEntity": { "EMAIL": 1 },
        "failuresByCode": { "FORMAT_CORRUPT": 1 }
      },
      "selection": { "includePatternCount": 5, "excludePatternCount": 0 },
      "limits": {
        "maximumFiles": 1000,
        "maximumDirectories": 1000,
        "maximumEntries": 10000,
        "maximumTotalInputBytes": 268435456,
        "maximumRelativePathCodeUnits": 8192,
        "maximumPatternMatchSteps": 100000000,
        "timeoutMs": 60000
      }
    }
  ]
}
